"paperId","publicationVenue","title","abstract","venue","year","citationCount","fieldsOfStudy","publicationTypes","publicationDate","journal","authors"
"348cd9726be5e5740ab751c15fbad4b60d98246d","","Patterns in Hydrogen Bonding: Functionality and Graph Set Analysis in Crystals","Whereas much of organic chemistry has classically dealt with the preparation and study of the properties of individual molecules, an increasingly significant portion of the activity in chemical research involves understanding and utilizing the nature of the interactions between molecules. Two representative areas of this evolution are supramolecular chemistry and molecular recognition. The interactions between molecules are governed by intermolecular forces whose energetic and geometric properties are much less well understood than those of classical chemical bonds between atoms. Among the strongest of these interactions, however, are hydrogen bonds, whose directional properties are better understood on the local level (that is, for a single hydrogen bond) than many other types of non-bonded interactions. Nevertheless, the means by which to characterize, understand, and predict the consequences of many hydrogen bonds among molecules, and the resulting formation of molecular aggregates (on the microscopic scale) or crystals (on the macroscopic scale) has remained largely enigmatic. One of the most promising systematic approaches to resolving this enigma was initially developed by the late M. C. Etter, who applied graph theory to recognize, and then utilize, patterns of hydrogen bonding for the understanding and design of molecular crystals. In working with Etter's original ideas the power and potential utility of this approach on one hand, and on the other, the need to develop and extend the initial Etter formalism was generally recognized. It with that latter purpose that we originally undertook the present review.","","1995","7386","['Chemistry']","['Review']","1995-08-18","{'name': 'Angewandte Chemie', 'pages': '1555-1573', 'volume': '34'}","[{'authorId': '144302936', 'name': 'J. Bernstein'}, {'authorId': '48778365', 'name': 'Raymond E. Davis'}, {'authorId': '2308579', 'name': 'L. Shimoni'}, {'authorId': '143976370', 'name': 'N. Chang'}]"
"04f3203f1214063436d81ce0c2ad7623204da488","{'id': '939c6e1d-0d17-4d6e-8a82-66d960df0e40', 'name': 'International Conference on Learning Representations', 'type': 'conference', 'alternate_names': ['Int Conf Learn Represent', 'ICLR'], 'url': 'https://iclr.cc/'}","Geom-GCN: Geometric Graph Convolutional Networks","Message-passing neural networks (MPNNs) have been successfully applied in a wide variety of applications in the real world. However, two fundamental weaknesses of MPNNs' aggregators limit their ability to represent graph-structured data: losing the structural information of nodes in neighborhoods and lacking the ability to capture long-range dependencies in disassortative graphs. Few studies have noticed the weaknesses from different perspectives. From the observations on classical neural network and network geometry, we propose a novel geometric aggregation scheme for graph neural networks to overcome the two weaknesses. The behind basic idea is the aggregation on a graph can benefit from a continuous space underlying the graph. The proposed aggregation scheme is permutation-invariant and consists of three modules, node embedding, structural neighborhood, and bi-level aggregation. We also present an implementation of the scheme in graph convolutional networks, termed Geom-GCN, to perform transductive learning on graphs. Experimental results show the proposed Geom-GCN achieved state-of-the-art performance on a wide range of open datasets of graphs.","International Conference on Learning Representations","2020","999","['Computer Science', 'Mathematics']","['JournalArticle']","2020-02-13","{'name': 'ArXiv', 'volume': 'abs/2002.05287'}","[{'authorId': '1866075', 'name': 'Hongbin Pei'}, {'authorId': '15763974', 'name': 'Bingzhen Wei'}, {'authorId': '143922493', 'name': 'K. Chang'}, {'authorId': '2113651237', 'name': 'Yu Lei'}, {'authorId': '2119658599', 'name': 'Bo Yang'}]"
"21e33bd0ad95ee1f79d8b778e693fd316cbb72d4","{'id': 'd9720b90-d60b-48bc-9df8-87a30b9a60dd', 'name': 'Neural Information Processing Systems', 'type': 'conference', 'alternate_names': ['Neural Inf Process Syst', 'NeurIPS', 'NIPS'], 'url': 'http://neurips.cc/'}","Beyond Homophily in Graph Neural Networks: Current Limitations and Effective Designs","We investigate the representation power of graph neural networks in the semi-supervised node classification task under heterophily or low homophily, i.e., in networks where connected nodes may have different class labels and dissimilar features. Many popular GNNs fail to generalize to this setting, and are even outperformed by models that ignore the graph structure (e.g., multilayer perceptrons). Motivated by this limitation, we identify a set of key designs -- ego- and neighbor-embedding separation, higher-order neighborhoods, and combination of intermediate representations -- that boost learning from the graph structure under heterophily. We combine them into a graph neural network, H2GCN, which we use as the base method to empirically evaluate the effectiveness of the identified designs. Going beyond the traditional benchmarks with strong homophily, our empirical analysis shows that the identified designs increase the accuracy of GNNs by up to 40% and 27% over models without them on synthetic and real networks with heterophily, respectively, and yield competitive performance under homophily.","Neural Information Processing Systems","2020","891","['Computer Science']","['JournalArticle']","2020-06-20","{'name': 'arXiv: Learning', 'volume': ''}","[{'authorId': '50077183', 'name': 'Jiong Zhu'}, {'authorId': '7957569', 'name': 'Yujun Yan'}, {'authorId': '21613538', 'name': 'Lingxiao Zhao'}, {'authorId': '35505461', 'name': 'Mark Heimann'}, {'authorId': '3255268', 'name': 'L. Akoglu'}, {'authorId': '2479152', 'name': 'Danai Koutra'}]"
"699d4d8c8b91b1a34dd6f47d28e3fe1236f25944","","Saliency Detection via Graph-Based Manifold Ranking","Most existing bottom-up methods measure the foreground saliency of a pixel or region based on its contrast within a local context or the entire image, whereas a few methods focus on segmenting out background regions and thereby salient objects. Instead of considering the contrast between the salient objects and their surrounding regions, we consider both foreground and background cues in a different way. We rank the similarity of the image elements (pixels or regions) with foreground cues or background cues via graph-based manifold ranking. The saliency of the image elements is defined based on their relevances to the given seeds or queries. We represent the image as a close-loop graph with super pixels as nodes. These nodes are ranked based on the similarity to background and foreground queries, based on affinity matrices. Saliency detection is carried out in a two-stage scheme to extract background regions and foreground salient objects efficiently. Experimental results on two large benchmark databases demonstrate the proposed method performs well when against the state-of-the-art methods in terms of accuracy and speed. We also create a more difficult benchmark database containing 5,172 images to test the proposed saliency model and make this database publicly available with this paper for further studies in the saliency field.","2013 IEEE Conference on Computer Vision and Pattern Recognition","2013","2281","['Computer Science']","['JournalArticle', 'Conference']","2013-06-23","{'name': '2013 IEEE Conference on Computer Vision and Pattern Recognition', 'pages': '3166-3173'}","[{'authorId': '2154926843', 'name': 'Chuan Yang'}, {'authorId': '50081215', 'name': 'L. Zhang'}, {'authorId': '153176123', 'name': 'Huchuan Lu'}, {'authorId': '144526777', 'name': 'Xiang Ruan'}, {'authorId': '1715634', 'name': 'Ming-Hsuan Yang'}]"
"c2d40522eaa5523d67a0de5e4098e7031fdccb3d","{'id': '1901e811-ee72-4b20-8f7e-de08cd395a10', 'name': 'arXiv.org', 'alternate_names': ['ArXiv'], 'issn': '2331-8422', 'url': 'https://arxiv.org'}","Pitfalls of Graph Neural Network Evaluation","Semi-supervised node classification in graphs is a fundamental problem in graph mining, and the recently proposed graph neural networks (GNNs) have achieved unparalleled results on this task. Due to their massive success, GNNs have attracted a lot of attention, and many novel architectures have been put forward. In this paper we show that existing evaluation strategies for GNN models have serious shortcomings. We show that using the same train/validation/test splits of the same datasets, as well as making significant changes to the training procedure (e.g. early stopping criteria) precludes a fair comparison of different architectures. We perform a thorough empirical evaluation of four prominent GNN models and show that considering different splits of the data leads to dramatically different rankings of models. Even more importantly, our findings suggest that simpler GNN architectures are able to outperform the more sophisticated ones if the hyperparameters and the training procedure are tuned fairly for all models.","arXiv.org","2018","1255","['Computer Science', 'Mathematics']","['JournalArticle']","2018-11-14","{'name': 'ArXiv', 'volume': 'abs/1811.05868'}","[{'authorId': '32724677', 'name': 'Oleksandr Shchur'}, {'authorId': '51896688', 'name': 'Maximilian Mumme'}, {'authorId': '11754930', 'name': 'Aleksandar Bojchevski'}, {'authorId': '3075189', 'name': 'Stephan Günnemann'}]"
"75739ed2ddebd7982042f516f407553f8d3110f8","{'id': '8dce23a9-44e0-4381-a39e-2acc1edff700', 'name': 'Annual International ACM SIGIR Conference on Research and Development in Information Retrieval', 'type': 'conference', 'alternate_names': ['International ACM SIGIR Conference on Research and Development in Information Retrieval', 'Int ACM SIGIR Conf Res Dev Inf Retr', 'SIGIR', 'Annu Int ACM SIGIR Conf Res Dev Inf Retr'], 'url': 'http://www.acm.org/sigir/'}","Self-supervised Graph Learning for Recommendation","Representation learning on user-item graph for recommendation has evolved from using single ID or interaction history to exploiting higher-order neighbors. This leads to the success of graph convolution networks (GCNs) for recommendation such as PinSage and LightGCN. Despite effectiveness, we argue that they suffer from two limitations: (1) high-degree nodes exert larger impact on the representation learning, deteriorating the recommendations of low-degree (long-tail) items; and (2) representations are vulnerable to noisy interactions, as the neighborhood aggregation scheme further enlarges the impact of observed edges. In this work, we explore self-supervised learning on user-item graph, so as to improve the accuracy and robustness of GCNs for recommendation. The idea is to supplement the classical supervised task of recommendation with an auxiliary self-supervised task, which reinforces node representation learning via self-discrimination. Specifically, we generate multiple views of a node, maximizing the agreement between different views of the same node compared to that of other nodes. We devise three operators to generate the views --- node dropout, edge dropout, and random walk --- that change the graph structure in different manners. We term this new learning paradigm asSelf-supervised Graph Learning (SGL), implementing it on the state-of-the-art model LightGCN. Through theoretical analyses, we find that SGL has the ability of automatically mining hard negatives. Empirical studies on three benchmark datasets demonstrate the effectiveness of SGL, which improves the recommendation accuracy, especially on long-tail items, and the robustness against interaction noises. Our implementations are available at \urlhttps://github.com/wujcan/SGL.","Annual International ACM SIGIR Conference on Research and Development in Information Retrieval","2020","1015","['Computer Science']","['JournalArticle', 'Book', 'Conference']","2020-10-21","{'name': 'Proceedings of the 44th International ACM SIGIR Conference on Research and Development in Information Retrieval'}","[{'authorId': '1491035012', 'name': 'Jiancan Wu'}, {'authorId': '2144796537', 'name': 'Xiang Wang'}, {'authorId': '2163400298', 'name': 'Fuli Feng'}, {'authorId': '7792071', 'name': 'Xiangnan He'}, {'authorId': '1853048147', 'name': 'Liang Chen'}, {'authorId': '2813328', 'name': 'Jianxun Lian'}, {'authorId': '2110972323', 'name': 'Xing Xie'}]"
"e3d662bbd0e5539fe22a85f3518f960595b9914e","{'id': 'a0edb93b-1e95-4128-a295-6b1659149cef', 'name': 'Knowledge Discovery and Data Mining', 'type': 'conference', 'alternate_names': ['KDD', 'Knowl Discov Data Min'], 'url': 'http://www.acm.org/sigkdd/'}","Heterogeneous Graph Neural Network","Representation learning in heterogeneous graphs aims to pursue a meaningful vector representation for each node so as to facilitate downstream applications such as link prediction, personalized recommendation, node classification, etc. This task, however, is challenging not only because of the demand to incorporate heterogeneous structural (graph) information consisting of multiple types of nodes and edges, but also due to the need for considering heterogeneous attributes or contents (e.g., text or image) associated with each node. Despite a substantial amount of effort has been made to homogeneous (or heterogeneous) graph embedding, attributed graph embedding as well as graph neural networks, few of them can jointly consider heterogeneous structural (graph) information as well as heterogeneous contents information of each node effectively. In this paper, we propose HetGNN, a heterogeneous graph neural network model, to resolve this issue. Specifically, we first introduce a random walk with restart strategy to sample a fixed size of strongly correlated heterogeneous neighbors for each node and group them based upon node types. Next, we design a neural network architecture with two modules to aggregate feature information of those sampled neighboring nodes. The first module encodes ""deep"" feature interactions of heterogeneous contents and generates content embedding for each node. The second module aggregates content (attribute) embeddings of different neighboring groups (types) and further combines them by considering the impacts of different groups to obtain the ultimate node embedding. Finally, we leverage a graph context loss and a mini-batch gradient descent procedure to train the model in an end-to-end manner. Extensive experiments on several datasets demonstrate that HetGNN can outperform state-of-the-art baselines in various graph mining tasks, i.e., link prediction, recommendation, node classification & clustering and inductive node classification & clustering.","Knowledge Discovery and Data Mining","2019","1219","['Computer Science']","['JournalArticle', 'Book', 'Conference']","2019-07-25","{'name': 'Proceedings of the 25th ACM SIGKDD International Conference on Knowledge Discovery & Data Mining'}","[{'authorId': '3407809', 'name': 'Chuxu Zhang'}, {'authorId': '2451800', 'name': 'Dongjin Song'}, {'authorId': '144277661', 'name': 'Chao Huang'}, {'authorId': '144231976', 'name': 'A. Swami'}, {'authorId': '144539424', 'name': 'N. Chawla'}]"
"44fca068eecce2203d111213e3691647914a3945","{'id': 'aef12dca-60a0-4ca3-819b-cad26d309d4e', 'name': 'Journal of Artificial Intelligence Research', 'type': 'journal', 'alternate_names': ['JAIR', 'J Artif Intell Res', 'The Journal of Artificial Intelligence Research'], 'issn': '1076-9757', 'url': 'http://www.jair.org/'}","LexRank: Graph-based Lexical Centrality as Salience in Text Summarization","We introduce a stochastic graph-based method for computing relative importance of textual units for Natural Language Processing. We test the technique on the problem of Text Summarization (TS). Extractive TS relies on the concept of sentence salience to identify the most important sentences in a document or set of documents. Salience is typically defined in terms of the presence of particular important words or in terms of similarity to a centroid pseudo-sentence. We consider a new approach, LexRank, for computing sentence importance based on the concept of eigenvector centrality in a graph representation of sentences. In this model, a connectivity matrix based on intra-sentence cosine similarity is used as the adjacency matrix of the graph representation of sentences. Our system, based on LexRank ranked in first place in more than one task in the recent DUC 2004 evaluation. In this paper we present a detailed analysis of our approach and apply it to a larger data set including data from earlier DUC evaluations. We discuss several methods to compute centrality using the similarity graph. The results show that degree-based methods (including LexRank) outperform both centroid-based methods and other systems participating in DUC in most of the cases. Furthermore, the LexRank with threshold method outperforms the other degree-based techniques including continuous LexRank. We also show that our approach is quite insensitive to the noise in the data that may result from an imperfect topical clustering of documents.","Journal of Artificial Intelligence Research","2004","3041","['Mathematics', 'Computer Science']","['JournalArticle']","2004-07-01","{'name': 'ArXiv', 'volume': 'abs/1109.2128'}","[{'authorId': '2158159', 'name': 'Günes Erkan'}, {'authorId': '9215251', 'name': 'Dragomir R. Radev'}]"
"5863d7b35ea317c19f707376978ef1cc53e3534c","{'id': 'd9720b90-d60b-48bc-9df8-87a30b9a60dd', 'name': 'Neural Information Processing Systems', 'type': 'conference', 'alternate_names': ['Neural Inf Process Syst', 'NeurIPS', 'NIPS'], 'url': 'http://neurips.cc/'}","Rethinking Graph Transformers with Spectral Attention","In recent years, the Transformer architecture has proven to be very successful in sequence processing, but its application to other data structures, such as graphs, has remained limited due to the difficulty of properly defining positions. Here, we present the $\textit{Spectral Attention Network}$ (SAN), which uses a learned positional encoding (LPE) that can take advantage of the full Laplacian spectrum to learn the position of each node in a given graph. This LPE is then added to the node features of the graph and passed to a fully-connected Transformer. By leveraging the full spectrum of the Laplacian, our model is theoretically powerful in distinguishing graphs, and can better detect similar sub-structures from their resonance. Further, by fully connecting the graph, the Transformer does not suffer from over-squashing, an information bottleneck of most GNNs, and enables better modeling of physical phenomenons such as heat transfer and electric interaction. When tested empirically on a set of 4 standard datasets, our model performs on par or better than state-of-the-art GNNs, and outperforms any attention-based model by a wide margin, becoming the first fully-connected architecture to perform well on graph benchmarks.","Neural Information Processing Systems","2021","465","['Computer Science']","['JournalArticle']","2021-06-07","{'name': 'ArXiv', 'volume': 'abs/2106.03893'}","[{'authorId': '2107709516', 'name': 'Devin Kreuzer'}, {'authorId': '51034451', 'name': 'D. Beaini'}, {'authorId': '2057555930', 'name': 'William L. Hamilton'}, {'authorId': '2067158294', 'name': ""Vincent L'etourneau""}, {'authorId': '12611623', 'name': 'Prudencio Tossou'}]"
"47ae807cd511b35e78a2cd4e198283dea6dafd41","{'id': '1901e811-ee72-4b20-8f7e-de08cd395a10', 'name': 'arXiv.org', 'alternate_names': ['ArXiv'], 'issn': '2331-8422', 'url': 'https://arxiv.org'}","Do Transformers Really Perform Bad for Graph Representation?","The Transformer architecture has become a dominant choice in many domains, such as natural language processing and computer vision. Yet, it has not achieved competitive performance on popular leaderboards of graph-level prediction compared to mainstream GNN variants. Therefore, it remains a mystery how Transformers could perform well for graph representation learning. In this paper, we solve this mystery by presenting Graphormer, which is built upon the standard Transformer architecture, and could attain excellent results on a broad range of graph representation learning tasks, especially on the recent OGB Large-Scale Challenge. Our key insight to utilizing Transformer in the graph is the necessity of effectively encoding the structural information of a graph into the model. To this end, we propose several simple yet effective structural encoding methods to help Graphormer better model graph-structured data. Besides, we mathematically characterize the expressive power of Graphormer and exhibit that with our ways of encoding the structural information of graphs, many popular GNN variants could be covered as the special cases of Graphormer.","arXiv.org","2021","426","['Computer Science']","['JournalArticle']","2021-06-09","{'name': 'ArXiv', 'volume': 'abs/2106.05234'}","[{'authorId': '2051552141', 'name': 'Chengxuan Ying'}, {'authorId': '123970124', 'name': 'Tianle Cai'}, {'authorId': '2108801920', 'name': 'Shengjie Luo'}, {'authorId': '150311931', 'name': 'Shuxin Zheng'}, {'authorId': '35286545', 'name': 'Guolin Ke'}, {'authorId': '1391126980', 'name': 'Di He'}, {'authorId': '2115437382', 'name': 'Yanming Shen'}, {'authorId': '2110264337', 'name': 'Tie-Yan Liu'}]"
"06c9cbf943185d1d1554e760279412598c6d81a6","{'id': '8dce23a9-44e0-4381-a39e-2acc1edff700', 'name': 'Annual International ACM SIGIR Conference on Research and Development in Information Retrieval', 'type': 'conference', 'alternate_names': ['International ACM SIGIR Conference on Research and Development in Information Retrieval', 'Int ACM SIGIR Conf Res Dev Inf Retr', 'SIGIR', 'Annu Int ACM SIGIR Conf Res Dev Inf Retr'], 'url': 'http://www.acm.org/sigir/'}","Are Graph Augmentations Necessary?: Simple Graph Contrastive Learning for Recommendation","Contrastive learning (CL) recently has spurred a fruitful line of research in the field of recommendation, since its ability to extract self-supervised signals from the raw data is well-aligned with recommender systems' needs for tackling the data sparsity issue. A typical pipeline of CL-based recommendation models is first augmenting the user-item bipartite graph with structure perturbations, and then maximizing the node representation consistency between different graph augmentations. Although this paradigm turns out to be effective, what underlies the performance gains is still a mystery. In this paper, we first experimentally disclose that, in CL-based recommendation models, CL operates by learning more uniform user/item representations that can implicitly mitigate the popularity bias. Meanwhile, we reveal that the graph augmentations, which used to be considered necessary, just play a trivial role. Based on this finding, we propose a simple CL method which discards the graph augmentations and instead adds uniform noises to the embedding space for creating contrastive views. A comprehensive experimental study on three benchmark datasets demonstrates that, though it appears strikingly simple, the proposed method can smoothly adjust the uniformity of learned representations and has distinct advantages over its graph augmentation-based counterparts in terms of recommendation accuracy and training efficiency. The code is released at https://github.com/Coder-Yu/QRec.","Annual International ACM SIGIR Conference on Research and Development in Information Retrieval","2021","510","['Computer Science']","['Book', 'JournalArticle', 'Conference']","2021-12-16","{'name': 'Proceedings of the 45th International ACM SIGIR Conference on Research and Development in Information Retrieval'}","[{'authorId': '28584977', 'name': 'Junliang Yu'}, {'authorId': '2416851', 'name': 'Hongzhi Yin'}, {'authorId': '2077454936', 'name': 'Xin Xia'}, {'authorId': '1490931831', 'name': 'Tong Chen'}, {'authorId': '101457473', 'name': 'Li-zhen Cui'}, {'authorId': '144133815', 'name': 'Q. Nguyen'}]"
