"paperId","publicationVenue","title","abstract","venue","year","citationCount","fieldsOfStudy","publicationTypes","publicationDate","journal","authors"
"8f096071a09701012c9c279aee2a88143a295935","{'id': '939c6e1d-0d17-4d6e-8a82-66d960df0e40', 'name': 'International Conference on Learning Representations', 'type': 'conference', 'alternate_names': ['Int Conf Learn Represent', 'ICLR'], 'url': 'https://iclr.cc/'}","RotatE: Knowledge Graph Embedding by Relational Rotation in Complex Space","We study the problem of learning representations of entities and relations in knowledge graphs for predicting missing links. The success of such a task heavily relies on the ability of modeling and inferring the patterns of (or between) the relations. In this paper, we present a new approach for knowledge graph embedding called RotatE, which is able to model and infer various relation patterns including: symmetry/antisymmetry, inversion, and composition. Specifically, the RotatE model defines each relation as a rotation from the source entity to the target entity in the complex vector space. In addition, we propose a novel self-adversarial negative sampling technique for efficiently and effectively training the RotatE model. Experimental results on multiple benchmark knowledge graphs show that the proposed RotatE model is not only scalable, but also able to infer and model various relation patterns and significantly outperform existing state-of-the-art models for link prediction.","International Conference on Learning Representations","2018","1970","['Computer Science', 'Mathematics']","['JournalArticle']","2018-09-27","{'name': 'ArXiv', 'volume': 'abs/1902.10197'}","[{'authorId': '48064856', 'name': 'Zhiqing Sun'}, {'authorId': '123580511', 'name': 'Zhihong Deng'}, {'authorId': '143619007', 'name': 'Jian-Yun Nie'}, {'authorId': '152226504', 'name': 'Jian Tang'}]"
"3efd851140aa28e95221b55fcc5659eea97b172d","{'id': '2ac50919-507e-41c7-93a8-721c4b804757', 'name': 'IEEE Transactions on Neural Networks', 'type': 'journal', 'alternate_names': ['IEEE Trans Neural Netw'], 'issn': '1045-9227', 'alternate_issns': ['1941-0093'], 'url': 'http://ieeexplore.ieee.org/servlet/opac?punumber=72'}","The Graph Neural Network Model","Many underlying relationships among data in several areas of science and engineering, e.g., computer vision, molecular chemistry, molecular biology, pattern recognition, and data mining, can be represented in terms of graphs. In this paper, we propose a new neural network model, called graph neural network (GNN) model, that extends existing neural network methods for processing the data represented in graph domains. This GNN model, which can directly process most of the practically useful types of graphs, e.g., acyclic, cyclic, directed, and undirected, implements a function tau(G,n) isin IRm that maps a graph G and one of its nodes n into an m-dimensional Euclidean space. A supervised learning algorithm is derived to estimate the parameters of the proposed GNN model. The computational cost of the proposed algorithm is also considered. Some experimental results are shown to validate the proposed learning algorithm, and to demonstrate its generalization capabilities.","IEEE Transactions on Neural Networks","2009","7005","['Computer Science', 'Medicine']","['JournalArticle', 'Study']","","{'name': 'IEEE Transactions on Neural Networks', 'pages': '61-80', 'volume': '20'}","[{'authorId': '47260481', 'name': 'F. Scarselli'}, {'authorId': '145467467', 'name': 'M. Gori'}, {'authorId': '1733691', 'name': 'A. Tsoi'}, {'authorId': '1784450', 'name': 'M. Hagenbuchner'}, {'authorId': '3073217', 'name': 'G. Monfardini'}]"
"1976c9eeccc7115d18a04f1e7fb5145db6b96002","","Freebase: a collaboratively created graph database for structuring human knowledge","Freebase is a practical, scalable tuple database used to structure general human knowledge. The data in Freebase is collaboratively created, structured, and maintained. Freebase currently contains more than 125,000,000 tuples, more than 4000 types, and more than 7000 properties. Public read/write access to Freebase is allowed through an HTTP-based graph-query API using the Metaweb Query Language (MQL) as a data query and manipulation language. MQL provides an easy-to-use object-oriented interface to the tuple data in Freebase and is designed to facilitate the creation of collaborative, Web-based data-oriented applications.","SIGMOD Conference","2008","5292","['Computer Science']","['JournalArticle', 'Conference']","2008-06-09","{'pages': '1247-1250'}","[{'authorId': '1742448', 'name': 'K. Bollacker'}, {'authorId': '2065123479', 'name': 'Colin Evans'}, {'authorId': '2990264', 'name': 'Praveen K. Paritosh'}, {'authorId': '1399112633', 'name': 'Tim Sturge'}, {'authorId': '2110748390', 'name': 'Jamie Taylor'}]"
"aeeffe327e6c93e9010c7b1e401caa9113723851","{'id': '939ee07c-6009-43f8-b884-69238b40659e', 'name': 'International Journal of Computer Vision', 'type': 'journal', 'alternate_names': ['Int J Comput Vis'], 'issn': '0920-5691', 'url': 'https://www.springer.com/computer/image+processing/journal/11263', 'alternate_urls': ['https://link.springer.com/journal/11263', 'http://link.springer.com/journal/11263']}","Efficient Graph-Based Image Segmentation","","International Journal of Computer Vision","2004","5789","['Computer Science', 'Mathematics']","['JournalArticle']","2004-09-01","{'name': 'International Journal of Computer Vision', 'pages': '167-181', 'volume': '59'}","[{'authorId': '1685089', 'name': 'Pedro F. Felzenszwalb'}, {'authorId': '1713089', 'name': 'D. Huttenlocher'}]"
"b8d9b10cf54629364523ec065e6307ab87f7d4f0","{'id': '3dbf084c-ef47-4b74-9919-047b40704538', 'name': 'Italian National Conference on Sensors', 'type': 'conference', 'alternate_names': ['SENSORS', 'IEEE Sens', 'Ital National Conf Sens', 'IEEE Sensors', 'Sensors'], 'issn': '1424-8220', 'url': 'http://www.e-helvetica.nb.admin.ch/directAccess?callnumber=bel-142001', 'alternate_urls': ['http://nbn-resolving.de/urn/resolver.pl?urn=urn:nbn:ch:bel-142001', 'http://www.mdpi.com/journal/sensors', 'https://www.mdpi.com/journal/sensors']}","iRun: Horizontal and Vertical Shape of a Region-Based Graph Compression","Graph data are pervasive worldwide, e.g., social networks, citation networks, and web graphs. A real-world graph can be huge and requires heavy computational and storage resources for processing. Various graph compression techniques have been presented to accelerate the processing time and utilize memory efficiently. SOTA approaches decompose a graph into fixed-size submatrices and compress it by applying the existing graph compression algorithm. This approach is promising if the input graph is dense. Otherwise, an optimal graph compression ratio cannot be achieved. Graphs such as those used by social networks exhibit a power-law distribution. Thus, applying compression to the fixed-size block of a matrix could lead to the empty cell processing of that matrix. In this paper, we solve the problem of ordered matrix compression on a deep level, dividing the block into sub-blocks to achieve the best compression ratio. We observe that the ordered matrix compression ratio could be improved by adopting variable-shape regions, considering both horizontal- and vertical-shaped regions. In our empirical evaluation, the proposed approach achieved a 93.8% compression ratio on average, compared with existing SOTA graph compression techniques.","Italian National Conference on Sensors","2022","1389","['Computer Science', 'Medicine']","['JournalArticle']","2022-12-01","{'name': 'Sensors (Basel, Switzerland)', 'volume': '22'}","[{'authorId': '2198082533', 'name': 'Muhammad Umair'}, {'authorId': '2145419030', 'name': 'Young-Koo Lee'}]"
"1d81e7f428fea2b2e15ee3a96fe843ca603acc4c","{'id': 'fc0a208c-acb7-47dc-a0d4-af8190e21d29', 'name': 'International Conference on Machine Learning', 'type': 'conference', 'alternate_names': ['ICML', 'Int Conf Mach Learn'], 'url': 'https://icml.cc/'}","Simple and Deep Graph Convolutional Networks","Graph convolutional networks (GCNs) are a powerful deep learning approach for graph-structured data. Recently, GCNs and subsequent variants have shown superior performance in various application areas on real-world datasets. Despite their success, most of the current GCN models are shallow, due to the {\em over-smoothing} problem. In this paper, we study the problem of designing and analyzing deep graph convolutional networks. We propose the GCNII, an extension of the vanilla GCN model with two simple yet effective techniques: {\em Initial residual} and {\em Identity mapping}. We provide theoretical and empirical evidence that the two techniques effectively relieves the problem of over-smoothing. Our experiments show that the deep GCNII model outperforms the state-of-the-art methods on various semi- and full-supervised tasks. Code is available at this https URL .","International Conference on Machine Learning","2020","1363","['Computer Science', 'Mathematics']","['JournalArticle', 'Conference']","2020-07-04","{'pages': '1725-1735'}","[{'authorId': '2108633355', 'name': 'Ming Chen'}, {'authorId': '12457830', 'name': 'Zhewei Wei'}, {'authorId': '3251920', 'name': 'Zengfeng Huang'}, {'authorId': '1696332', 'name': 'Bolin Ding'}, {'authorId': '2110479359', 'name': 'Yaliang Li'}]"
"2a3f862199883ceff5e3c74126f0c80770653e05","{'id': 'bdc2e585-4e48-4e36-8af1-6d859763d405', 'name': 'AAAI Conference on Artificial Intelligence', 'type': 'conference', 'alternate_names': ['National Conference on Artificial Intelligence', 'National Conf Artif Intell', 'AAAI Conf Artif Intell', 'AAAI'], 'url': 'http://www.aaai.org/'}","Knowledge Graph Embedding by Translating on Hyperplanes","    We deal with embedding a large scale knowledge graph composed of entities and relations into a continuous vector space. TransE is a promising method proposed recently, which is very efficient while achieving state-of-the-art predictive performance. We discuss some mapping properties of relations which should be considered in embedding, such as reflexive, one-to-many, many-to-one, and many-to-many. We note that TransE does not do well in dealing with these properties. Some complex models are capable of preserving these mapping properties but sacrifice efficiency in the process. To make a good trade-off between model capacity and efficiency, in this paper we propose TransH which models a relation as a hyperplane together with a translation operation on it. In this way, we can well preserve the above mapping properties of relations with almost the same model complexity of TransE. Additionally, as a practical knowledge graph is often far from completed, how to construct negative examples to reduce false negative labels in training is very important. Utilizing the one-to-many/many-to-one mapping property of a relation, we propose a simple trick to reduce the possibility of false negative labeling. We conduct extensive experiments on link prediction, triplet classification and fact extraction on benchmark datasets like WordNet and Freebase. Experiments show TransH delivers significant improvements over TransE on predictive accuracy with comparable capability to scale up.   ","AAAI Conference on Artificial Intelligence","2014","3415","['Computer Science']","['JournalArticle', 'Conference']","2014-06-21","{'pages': '1112-1119'}","[{'authorId': '2118452539', 'name': 'Zhen Wang'}, {'authorId': '2108090984', 'name': 'Jianwen Zhang'}, {'authorId': '2592554', 'name': 'Jianlin Feng'}, {'authorId': '35773227', 'name': 'Zheng Chen'}]"
"d18b48f77eb5c517a6d2c1fa434d2952a1b0a825","{'id': 'd9720b90-d60b-48bc-9df8-87a30b9a60dd', 'name': 'Neural Information Processing Systems', 'type': 'conference', 'alternate_names': ['Neural Inf Process Syst', 'NeurIPS', 'NIPS'], 'url': 'http://neurips.cc/'}","Hierarchical Graph Representation Learning with Differentiable Pooling","Recently, graph neural networks (GNNs) have revolutionized the field of graph representation learning through effectively learned node embeddings, and achieved state-of-the-art results in tasks such as node classification and link prediction. However, current GNN methods are inherently flat and do not learn hierarchical representations of graphs---a limitation that is especially problematic for the task of graph classification, where the goal is to predict the label associated with an entire graph. Here we propose DiffPool, a differentiable graph pooling module that can generate hierarchical representations of graphs and can be combined with various graph neural network architectures in an end-to-end fashion. DiffPool learns a differentiable soft cluster assignment for nodes at each layer of a deep GNN, mapping nodes to a set of clusters, which then form the coarsened input for the next GNN layer. Our experimental results show that combining existing GNN methods with DiffPool yields an average improvement of 5-10% accuracy on graph classification benchmarks, compared to all existing pooling approaches, achieving a new state-of-the-art on four out of five benchmark datasets.","Neural Information Processing Systems","2018","2049","['Computer Science', 'Mathematics']","['JournalArticle']","2018-06-22","{'name': 'ArXiv', 'volume': 'abs/1806.08804'}","[{'authorId': '83539859', 'name': 'Rex Ying'}, {'authorId': '145829303', 'name': 'Jiaxuan You'}, {'authorId': '143622465', 'name': 'Christopher Morris'}, {'authorId': '145201124', 'name': 'Xiang Ren'}, {'authorId': '49437682', 'name': 'William L. Hamilton'}, {'authorId': '1702139', 'name': 'J. Leskovec'}]"
"6bc77c4dc6075ee81c05f0f5f43e44b2a34a5876","","Graph Theory with Applications","When I first entered the world of Mathematics, I became aware of a strange and little-regarded sect of ""Graph Theorists"", inhabiting a shadowy borderland known to the rest of the community as the ""slums of Topology"". What changes there have been in a few short years! That shadowy borderland has become a thriving metropolis. International conferences on Graph Theory occur with almost embarrassing frequency. Journals on Graph Theory abound: I once counted the Editorial Offices of three of them in one of the mathematical departments of one of the Universities of one of the smaller cities of Canada. Any connection with Topology is likely to be firmly repudiated as soon as noted. I became aware of the burgeoning of Graph Theory when I studied the 1940 paper of Brooks, Smith, Stone and Tutte in the Duke Mathematical Journal, ostensibly on squared rectangles. They wrote of trees and Kirchhoffs Laws, of 3-connection and planarity, of duality and symmetry, of determinantal identities and coprime integers, ~ all in the Quest of the Perfect Square. I invariably recommend that paper to my students. ""Go to it"", I say, ""you will","","1977","5536","['Computer Science']","","","{'name': 'Journal of the Operational Research Society', 'volume': ''}","[{'authorId': '48611572', 'name': 'E. S. Buffa'}]"
"415224a9aff759f6972189df8b7761dfd6a81154","{'id': '992e3995-f295-4778-a913-3fe2f227da3f', 'name': 'Mathematical Gazette', 'type': 'journal', 'alternate_names': ['Math Gaz', 'The Mathematical Gazette'], 'issn': '0025-5572', 'url': 'https://www.cambridge.org/core/journals/mathematical-gazette', 'alternate_urls': ['https://www.m-a.org.uk/resources/periodicals/the_mathematical_gazette/', 'http://journals.cambridge.org/MAG', 'https://www.jstor.org/journal/mathgaze']}","Introduction to graph theory","In graph theory, the term graph refers to a set of vertices and a set of edges. A vertex can be used to represent any object. Graphs may contain undirected or directed edges. An undirected edge is a set of two vertices. A directed edge is an ordered pair of two vertices where the edge goes from the first vertex to the second vertex. Graphs that contain directed edges are called directed graphs or digraphs.","Mathematical Gazette","1973","6800","['Computer Science']","['JournalArticle']","1973-12-01","{'name': 'The Mathematical Gazette', 'pages': '348 - 348', 'volume': '57'}","[{'authorId': '1774907', 'name': 'K. Fraughnaugh'}]"
"9697d32ed0a16da167f2bdba05ef96d0da066eb5","{'id': 'bdc2e585-4e48-4e36-8af1-6d859763d405', 'name': 'AAAI Conference on Artificial Intelligence', 'type': 'conference', 'alternate_names': ['National Conference on Artificial Intelligence', 'National Conf Artif Intell', 'AAAI Conf Artif Intell', 'AAAI'], 'url': 'http://www.aaai.org/'}","Convolutional 2D Knowledge Graph Embeddings","    Link prediction for knowledge graphs is the task of predicting missing relationships between entities. Previous work on link prediction has focused on shallow, fast models which can scale to large knowledge graphs. However, these models learn less expressive features than deep, multi-layer models — which potentially limits performance. In this work we introduce ConvE, a multi-layer convolutional network model for link prediction, and report state-of-the-art results for several established datasets. We also show that the model is highly parameter efficient, yielding the same performance as DistMult and R-GCN with 8x and 17x fewer parameters. Analysis of our model suggests that it is particularly effective at modelling nodes with high indegree — which are common in highly-connected, complex knowledge graphs such as Freebase and YAGO3. In addition, it has been noted that the WN18 and FB15k datasets suffer from test set leakage, due to inverse relations from the training set being present in the test set — however, the extent of this issue has so far not been quantified. We find this problem to be severe: a simple rule-based model can achieve state-of-the-art results on both WN18 and FB15k. To ensure that models are evaluated on datasets where simply exploiting inverse relations cannot yield competitive results, we investigate and validate several commonly used datasets — deriving robust variants where necessary. We then perform experiments on these robust datasets for our own and several previously proposed models, and find that ConvE achieves state-of-the-art Mean Reciprocal Rank across all datasets.   ","AAAI Conference on Artificial Intelligence","2017","2454","['Computer Science', 'Mathematics']","['JournalArticle', 'Conference']","2017-07-05","{'pages': '1811-1818'}","[{'authorId': '3239480', 'name': 'Tim Dettmers'}, {'authorId': '3051815', 'name': 'Pasquale Minervini'}, {'authorId': '1918552', 'name': 'Pontus Stenetorp'}, {'authorId': '48662861', 'name': 'Sebastian Riedel'}]"
"385742fffcf113656f0d3cf6c06ef95cb8439dc6","","Depth-First Search and Linear Graph Algorithms","The value of depth-first search or “backtracking” as a technique for solving problems is illustrated by two examples. An improved version of an algorithm for finding the strongly connected components of a directed graph and at algorithm for finding the biconnected components of an undirect graph are presented. The space and time requirements of both algorithms are bounded by $k_1 V + k_2 E + k_3 $ for some constants $k_1 ,k_2 $, and $k_3 $, where V is the number of vertices and E is the number of edges of the graph being examined.","SIAM journal on computing (Print)","1972","6919","['Mathematics', 'Computer Science']","['JournalArticle']","1972-06-01","{'name': 'SIAM J. Comput.', 'pages': '146-160', 'volume': '1'}","[{'authorId': '1721050', 'name': 'R. Tarjan'}]"
"f412bb31ec9ef8bbef70eefc7ffd04420c1365d9","{'id': 'd9720b90-d60b-48bc-9df8-87a30b9a60dd', 'name': 'Neural Information Processing Systems', 'type': 'conference', 'alternate_names': ['Neural Inf Process Syst', 'NeurIPS', 'NIPS'], 'url': 'http://neurips.cc/'}","Graph-Based Visual Saliency","A new bottom-up visual saliency model, Graph-Based Visual Saliency (GBVS), is proposed. It consists of two steps: first forming activation maps on certain feature channels, and then normalizing them in a way which highlights conspicuity and admits combination with other maps. The model is simple, and biologically plausible insofar as it is naturally parallelized. This model powerfully predicts human fixations on 749 variations of 108 natural images, achieving 98% of the ROC area of a human-based control, whereas the classical algorithms of Itti & Koch ([2], [3], [4]) achieve only 84%.","Neural Information Processing Systems","2006","3733","['Computer Science']","['JournalArticle', 'Conference']","2006-12-04","{'pages': '545-552'}","[{'authorId': '39810944', 'name': 'Jonathan Harel'}, {'authorId': '145624227', 'name': 'C. Koch'}, {'authorId': '1690922', 'name': 'P. Perona'}]"
"fae129338c0899576524506008427f64477d3967","{'id': '67f7f831-711a-43c8-8785-1e09005359b5', 'name': 'International Joint Conference on Artificial Intelligence', 'type': 'conference', 'alternate_names': ['Int Jt Conf Artif Intell', 'IJCAI'], 'url': 'http://www.ijcai.org/'}","Graph WaveNet for Deep Spatial-Temporal Graph Modeling","Spatial-temporal graph modeling is an important task to analyze the spatial relations and temporal trends of components in a system. Existing approaches mostly capture the spatial dependency on a fixed graph structure, assuming that the underlying relation between entities is pre-determined. However, the explicit graph structure (relation) does not necessarily reflect the true dependency and genuine relation may be missing due to the incomplete connections in the data. Furthermore, existing methods are ineffective to capture the temporal trends as the RNNs or CNNs employed in these methods cannot capture long-range temporal sequences. To overcome these limitations, we propose in this paper a novel graph neural network architecture, {Graph WaveNet}, for spatial-temporal graph modeling. By developing a novel adaptive dependency matrix and learn it through node embedding, our model can precisely capture the hidden spatial dependency in the data. With a stacked dilated 1D convolution component whose receptive field grows exponentially as the number of layers increases, Graph WaveNet is able to handle very long sequences. These two components are integrated seamlessly in a unified framework and the whole framework is learned in an end-to-end manner. Experimental results on two public traffic network datasets, METR-LA and PEMS-BAY, demonstrate the superior performance of our algorithm.","International Joint Conference on Artificial Intelligence","2019","1917","['Computer Science', 'Mathematics']","['JournalArticle', 'Conference']","2019-05-31","{'pages': '1907-1913'}","[{'authorId': '2109557884', 'name': 'Zonghan Wu'}, {'authorId': '2585415', 'name': 'Shirui Pan'}, {'authorId': '2062835', 'name': 'Guodong Long'}, {'authorId': '1746594', 'name': 'Jing Jiang'}, {'authorId': '48934799', 'name': 'Chengqi Zhang'}]"
"30321b036607a7936221235ea8ec7cf7c1627100","{'id': 'c6840156-ee10-4d78-8832-7f8909811576', 'name': 'IEEE Transactions on Knowledge and Data Engineering', 'type': 'journal', 'alternate_names': ['IEEE Trans Knowl Data Eng'], 'issn': '1041-4347', 'url': 'https://www.computer.org/web/tkde', 'alternate_urls': ['http://ieeexplore.ieee.org/servlet/opac?punumber=69']}","Knowledge Graph Embedding: A Survey of Approaches and Applications","Knowledge graph (KG) embedding is to embed components of a KG including entities and relations into continuous vector spaces, so as to simplify the manipulation while preserving the inherent structure of the KG. It can benefit a variety of downstream tasks such as KG completion and relation extraction, and hence has quickly gained massive attention. In this article, we provide a systematic review of existing techniques, including not only the state-of-the-arts but also those with latest trends. Particularly, we make the review based on the type of information used in the embedding task. Techniques that conduct embedding using only facts observed in the KG are first introduced. We describe the overall framework, specific model design, typical training procedures, as well as pros and cons of such techniques. After that, we discuss techniques that further incorporate additional information besides facts. We focus specifically on the use of entity types, relation paths, textual descriptions, and logical rules. Finally, we briefly introduce how KG embedding can be applied to and benefit a wide variety of downstream tasks such as KG completion, relation extraction, question answering, and so forth.","IEEE Transactions on Knowledge and Data Engineering","2017","2117","['Computer Science']","['JournalArticle', 'Review']","2017-12-01","{'name': 'IEEE Transactions on Knowledge and Data Engineering', 'pages': '2724-2743', 'volume': '29'}","[{'authorId': '143906199', 'name': 'Quan Wang'}, {'authorId': '1855978', 'name': 'Zhendong Mao'}, {'authorId': '37722675', 'name': 'Bin Wang'}, {'authorId': '48358041', 'name': 'Li Guo'}]"
